{
  "$schema": "./runtime_attestations.schema.json",
  "schemaVersion": 1,
  "nativeItems": [
    {
      "runtimeItemId": "ApolloWeaponBoon",
      "claims": [
        {
          "claimId": "native-item-ApolloWeaponBoon-type",
          "predicate": "nativeType",
          "value": "Trait",
          "status": "validated",
          "evidenceIds": [
            "native-file-traitdata_apollo"
          ]
        }
      ]
    },
    {
      "runtimeItemId": "HephaestusSpecialBoon",
      "claims": [
        {
          "claimId": "native-item-HephaestusSpecialBoon-type",
          "predicate": "nativeType",
          "value": "Trait",
          "status": "validated",
          "evidenceIds": [
            "native-file-traitdata_hephaestus"
          ]
        }
      ]
    },
    {
      "runtimeItemId": "DemeterCastBoon",
      "claims": [
        {
          "claimId": "native-item-DemeterCastBoon-type",
          "predicate": "nativeType",
          "value": "Trait",
          "status": "validated",
          "evidenceIds": [
            "native-file-traitdata_demeter"
          ]
        }
      ]
    },
    {
      "runtimeItemId": "PoseidonSprintBoon",
      "claims": [
        {
          "claimId": "native-item-PoseidonSprintBoon-type",
          "predicate": "nativeType",
          "value": "Trait",
          "status": "validated",
          "evidenceIds": [
            "native-file-traitdata_poseidon"
          ]
        }
      ]
    },
    {
      "runtimeItemId": "HephaestusManaBoon",
      "claims": [
        {
          "claimId": "native-item-HephaestusManaBoon-type",
          "predicate": "nativeType",
          "value": "Trait",
          "status": "validated",
          "evidenceIds": [
            "native-file-traitdata_hephaestus"
          ]
        }
      ]
    },
    {
      "runtimeItemId": "DoubleStrikeChanceBoon",
      "claims": [
        {
          "claimId": "native-item-DoubleStrikeChanceBoon-type",
          "predicate": "nativeType",
          "value": "Trait",
          "status": "validated",
          "evidenceIds": [
            "native-file-traitdata_apollo"
          ]
        }
      ]
    },
    {
      "runtimeItemId": "CastNovaBoon",
      "claims": [
        {
          "claimId": "native-item-CastNovaBoon-type",
          "predicate": "nativeType",
          "value": "Trait",
          "status": "validated",
          "evidenceIds": [
            "native-file-traitdata_demeter"
          ]
        }
      ]
    },
    {
      "runtimeItemId": "EncounterStartDefenseBuffBoon",
      "claims": [
        {
          "claimId": "native-item-EncounterStartDefenseBuffBoon-type",
          "predicate": "nativeType",
          "value": "Trait",
          "status": "validated",
          "evidenceIds": [
            "native-file-traitdata_hephaestus"
          ]
        }
      ]
    },
    {
      "runtimeItemId": "FocusDamageShaveBoon",
      "claims": [
        {
          "claimId": "native-item-FocusDamageShaveBoon-type",
          "predicate": "nativeType",
          "value": "Trait",
          "status": "validated",
          "evidenceIds": [
            "native-file-traitdata_poseidon"
          ]
        }
      ]
    },
    {
      "runtimeItemId": "EncounterStartOffenseBuffBoon",
      "claims": [
        {
          "claimId": "native-item-EncounterStartOffenseBuffBoon-type",
          "predicate": "nativeType",
          "value": "Trait",
          "status": "validated",
          "evidenceIds": [
            "native-file-traitdata_poseidon"
          ]
        }
      ]
    },
    {
      "runtimeItemId": "RootDurationBoon",
      "claims": [
        {
          "claimId": "native-item-RootDurationBoon-type",
          "predicate": "nativeType",
          "value": "Trait",
          "status": "validated",
          "evidenceIds": [
            "native-file-traitdata_demeter"
          ]
        }
      ]
    },
    {
      "runtimeItemId": "InsideCastCritBoon",
      "claims": [
        {
          "claimId": "native-item-InsideCastCritBoon-type",
          "predicate": "nativeType",
          "value": "Trait",
          "status": "validated",
          "evidenceIds": [
            "native-file-traitdata_artemis"
          ]
        }
      ]
    },
    {
      "runtimeItemId": "ChaosWeaponBlessing",
      "claims": [
        {
          "claimId": "native-item-ChaosWeaponBlessing-type",
          "predicate": "nativeType",
          "value": "Trait",
          "status": "validated",
          "evidenceIds": [
            "native-file-traitdata_chaos"
          ]
        }
      ]
    },
    {
      "runtimeItemId": "ChaosHealthBlessing",
      "claims": [
        {
          "claimId": "native-item-ChaosHealthBlessing-type",
          "predicate": "nativeType",
          "value": "Trait",
          "status": "validated",
          "evidenceIds": [
            "native-file-traitdata_chaos"
          ]
        }
      ]
    },
    {
      "runtimeItemId": "ZeusSpecialBoon",
      "claims": [
        {
          "claimId": "native-item-ZeusSpecialBoon-type",
          "predicate": "nativeType",
          "value": "Trait",
          "status": "validated",
          "evidenceIds": [
            "native-file-traitdata_zeus"
          ]
        }
      ]
    },
    {
      "runtimeItemId": "HeraWeaponBoon",
      "claims": [
        {
          "claimId": "native-item-HeraWeaponBoon-type",
          "predicate": "nativeType",
          "value": "Trait",
          "status": "validated",
          "evidenceIds": [
            "native-file-traitdata_hera"
          ]
        }
      ]
    },
    {
      "runtimeItemId": "AresManaBoon",
      "claims": [
        {
          "claimId": "native-item-AresManaBoon-type",
          "predicate": "nativeType",
          "value": "Trait",
          "status": "validated",
          "evidenceIds": [
            "native-file-traitdata_ares"
          ]
        }
      ]
    },
    {
      "runtimeItemId": "DoubleBoltBoon",
      "claims": [
        {
          "claimId": "native-item-DoubleBoltBoon-type",
          "predicate": "nativeType",
          "value": "Trait",
          "status": "validated",
          "evidenceIds": [
            "native-file-traitdata_zeus"
          ]
        }
      ]
    },
    {
      "runtimeItemId": "FocusLightningBoon",
      "claims": [
        {
          "claimId": "native-item-FocusLightningBoon-type",
          "predicate": "nativeType",
          "value": "Trait",
          "status": "validated",
          "evidenceIds": [
            "native-file-traitdata_zeus"
          ]
        }
      ]
    },
    {
      "runtimeItemId": "ReserveManaHitShieldBoon",
      "claims": [
        {
          "claimId": "native-item-ReserveManaHitShieldBoon-type",
          "predicate": "nativeType",
          "value": "Trait",
          "status": "validated",
          "evidenceIds": [
            "native-file-traitdata_demeter"
          ]
        }
      ]
    },
    {
      "runtimeItemId": "LinkedDeathDamageBoon",
      "claims": [
        {
          "claimId": "native-item-LinkedDeathDamageBoon-type",
          "predicate": "nativeType",
          "value": "Trait",
          "status": "validated",
          "evidenceIds": [
            "native-file-traitdata_hera"
          ]
        }
      ]
    },
    {
      "runtimeItemId": "MissingHealthCritBoon",
      "claims": [
        {
          "claimId": "native-item-MissingHealthCritBoon-type",
          "predicate": "nativeType",
          "value": "Trait",
          "status": "validated",
          "evidenceIds": [
            "native-file-traitdata_ares"
          ]
        }
      ]
    },
    {
      "runtimeItemId": "DeathDefianceRefillBoon",
      "claims": [
        {
          "claimId": "native-item-DeathDefianceRefillBoon-type",
          "predicate": "nativeType",
          "value": "Trait",
          "status": "validated",
          "evidenceIds": [
            "native-file-traitdata_athena"
          ]
        }
      ]
    },
    {
      "runtimeItemId": "HadesDeathDefianceDamageBoon",
      "claims": [
        {
          "claimId": "native-item-HadesDeathDefianceDamageBoon-type",
          "predicate": "nativeType",
          "value": "Trait",
          "status": "validated",
          "evidenceIds": [
            "native-file-traitdata_hades"
          ]
        }
      ]
    }
  ],
  "offerSources": [
    {
      "offerSource": "NPC_Artemis_Field_01",
      "claims": [
        {
          "claimId": "source-NPC_Artemis_Field_01-type",
          "predicate": "sourceType",
          "value": "NPCReward",
          "status": "validated",
          "evidenceIds": [
            "native-file-npcdata_artemis"
          ]
        }
      ]
    },
    {
      "offerSource": "NPC_Athena_01",
      "claims": [
        {
          "claimId": "source-NPC_Athena_01-type",
          "predicate": "sourceType",
          "value": "NPCReward",
          "status": "validated",
          "evidenceIds": [
            "native-file-npcdata_athena"
          ]
        }
      ]
    },
    {
      "offerSource": "NPC_Hades_Field_01",
      "claims": [
        {
          "claimId": "source-NPC_Hades_Field_01-type",
          "predicate": "sourceType",
          "value": "NPCReward",
          "status": "validated",
          "evidenceIds": [
            "native-file-npcdata_hades"
          ]
        }
      ]
    },
    {
      "offerSource": "TrialUpgrade",
      "claims": [
        {
          "claimId": "source-TrialUpgrade-type",
          "predicate": "sourceType",
          "value": "TrialReward",
          "status": "validated",
          "evidenceIds": [
            "native-file-lootdata_chaos"
          ]
        }
      ]
    }
  ],
  "sourceBoonPairs": [
    {
      "pairId": "pair-NPC_Artemis_Field_01-InsideCastCritBoon",
      "offerSource": "NPC_Artemis_Field_01",
      "runtimeItemId": "InsideCastCritBoon",